{
  "$schema": "https://json-schema.org/draft/2020-12/schema",
  "$id": "https://example.local/opencode/skills/quote_review_output_skill/input.schema.json",
  "title": "quote_review_output_skill input",
  "type": "object",
  "additionalProperties": false,
  "required": [
    "quote_request",
    "feasibility_result",
    "historical_reference",
    "pricing_result"
  ],
  "properties": {
    "quote_request": { "type": "object" },
    "feasibility_result": { "type": "object" },
    "historical_reference": { "type": "object" },
    "pricing_result": { "type": "object" }
  }
}
