{
  "quote_request": {
    "request_meta": {
      "request_id": "qr-demo-001",
      "source": "assessment_report",
      "prepared_at": "2026-04-09T06:39:59.068439+00:00",
      "language": "zh-CN"
    },
    "header_context": {
      "currency": "USD",
      "vessel_name": "MV EXAMPLE",
      "imo_no": "1234567",
      "vessel_type": "Tanker",
      "customer_name": "ABC Shipping",
      "service_port": "Zhapu Port, China",
      "service_date": "2026-04-09",
      "attention": "Technical Dept.",
      "customer_ref_no": "REF-001"
    },
    "commercial_context": {
      "preferred_currency": "USD",
      "pricing_expectation": null,
      "special_terms": [
        "Any additional repair not listed above will be charged extra."
      ]
    },
    "source_refs": {
      "assessment_report_id": "demo-001",
      "customer_context_ref": null,
      "business_context_ref": null
    }
  },
  "feasibility_result": {
    "review_flags": [
      {
        "flag_code": "partial_quote_scope",
        "severity": "medium",
        "message": "当前仅部分项目具备报价条件。",
        "related_item_ids": [
          "svc-1",
          "spr-1"
        ]
      }
    ],
    "missing_fields": [
      {
        "field": "spare_parts_context.spare_parts_supply_mode",
        "required_for": [
          "feasibility_check",
          "pricing"
        ],
        "severity": "medium",
        "reason": "备件供货责任未确认，影响是否纳入报价。",
        "suggested_source": "customer_context"
      }
    ]
  },
  "historical_reference": {
    "matches": [
      {
        "quote_id": "hist-001",
        "similarity": 0.82,
        "reason": "服务模式、地点类型和核心服务项高度相似。"
      }
    ]
  },
  "pricing_result": {
    "quotation_options": [
      {
        "option_id": "option-a",
        "title": "Option A Standard quotation",
        "sections": [
          {
            "section_id": "section-service",
            "section_type": "service",
            "title": "Service",
            "groups": [
              {
                "group_id": "group-svc-1",
                "group_no": "1",
                "title": "AE-1 crankshaft trueness checks in place",
                "description": "服务项标题和范围已基本明确，可进入报价。",
                "lines": [
                  {
                    "line_id": "option-a-line-svc-1",
                    "item": "1",
                    "line_no": "1",
                    "line_type": "priced",
                    "description": "AE-1 crankshaft trueness checks in place Working time abt 15 hours",
                    "pricing_mode": "lump_sum",
                    "unit_price": 962.5,
                    "unit_price_display": "962.50",
                    "unit": "job",
                    "qty": 1,
                    "qty_display": "1",
                    "discount": null,
                    "amount": 962.5,
                    "amount_display": "962.50",
                    "currency": "USD",
                    "status": "chargeable",
                    "basis": "workflow_service_rate",
                    "conditions": [],
                    "notes": [
                      "服务项标题和范围已基本明确，可进入报价。"
                    ]
                  },
                  {
                    "line_id": "option-a-line-svc-1-scope-1",
                    "item": "",
                    "line_no": "",
                    "line_type": "scope_note",
                    "description": "2pcs M/B lower bearing remove",
                    "pricing_mode": "text_only",
                    "unit_price": null,
                    "unit_price_display": "",
                    "unit": "",
                    "qty": null,
                    "qty_display": "",
                    "discount": null,
                    "amount": null,
                    "amount_display": "",
                    "currency": "USD",
                    "status": "chargeable",
                    "basis": "included_scope",
                    "conditions": [],
                    "notes": []
                  }
                ]
              }
            ]
          }
        ],
        "summary": {
          "service_charge": {
            "value_type": "amount",
            "amount": 962.5,
            "display": "962.50",
            "currency": "USD",
            "status": "chargeable"
          },
          "spare_parts_fee": {
            "value_type": "status",
            "amount": null,
            "display": "Pending",
            "currency": "USD",
            "status": "pending"
          },
          "other": {
            "value_type": "amount",
            "amount": 0.0,
            "display": "0.00",
            "currency": "USD",
            "status": "chargeable"
          },
          "total": {
            "value_type": "status",
            "amount": null,
            "display": "Pending",
            "currency": "USD",
            "status": "pending"
          }
        },
        "remarks": [
          {
            "type": "commercial",
            "text": "Other repair if needed to be charged extra"
          }
        ]
      },
      {
        "option_id": "option-b",
        "title": "Option B 5% discount quotation",
        "sections": [
          {
            "section_id": "option-b-section-service",
            "section_type": "service",
            "title": "Service",
            "groups": [
              {
                "group_id": "option-b-group-svc-1",
                "group_no": "1",
                "title": "AE-1 crankshaft trueness checks in place",
                "description": "服务项标题和范围已基本明确，可进入报价。",
                "lines": [
                  {
                    "line_id": "option-b-line-svc-1",
                    "item": "1",
                    "line_no": "1",
                    "line_type": "priced",
                    "description": "AE-1 crankshaft trueness checks in place Working time abt 15 hours",
                    "pricing_mode": "lump_sum",
                    "unit_price": 962.5,
                    "unit_price_display": "962.50",
                    "unit": "job",
                    "qty": 1,
                    "qty_display": "1",
                    "discount": {
                      "type": "percentage",
                      "value": 5,
                      "display": "5%"
                    },
                    "amount": 914.38,
                    "amount_display": "914.38",
                    "currency": "USD",
                    "status": "chargeable",
                    "basis": "workflow_service_rate",
                    "conditions": [],
                    "notes": [
                      "服务项标题和范围已基本明确，可进入报价。"
                    ],
                    "relation": {
                      "type": "alternative_to",
                      "target_line_id": "option-a-line-svc-1"
                    }
                  },
                  {
                    "line_id": "option-b-line-svc-1-discount-note",
                    "item": "",
                    "line_no": "",
                    "line_type": "commercial_note",
                    "description": "Commercial discount 5% applied within approved authority.",
                    "pricing_mode": "text_only",
                    "unit_price": null,
                    "unit_price_display": "",
                    "unit": "",
                    "qty": null,
                    "qty_display": "",
                    "discount": null,
                    "amount": null,
                    "amount_display": "",
                    "currency": "USD",
                    "status": "chargeable",
                    "basis": "discount_authority",
                    "conditions": [],
                    "notes": []
                  }
                ]
              }
            ]
          }
        ],
        "summary": {
          "service_charge": {
            "value_type": "amount",
            "amount": 914.38,
            "display": "914.38",
            "currency": "USD",
            "status": "chargeable"
          },
          "spare_parts_fee": {
            "value_type": "status",
            "amount": null,
            "display": "Pending",
            "currency": "USD",
            "status": "pending"
          },
          "other": {
            "value_type": "amount",
            "amount": 0.0,
            "display": "0.00",
            "currency": "USD",
            "status": "chargeable"
          },
          "total": {
            "value_type": "status",
            "amount": null,
            "display": "Pending",
            "currency": "USD",
            "status": "pending"
          }
        },
        "remarks": [
          {
            "type": "commercial",
            "text": "Other repair if needed to be charged extra"
          },
          {
            "type": "commercial",
            "text": "Commercial discount 5% applied within operator authority."
          }
        ]
      }
    ]
  }
}
